{
  "run_id": "r-fixture-helm-run-v1-tampered-0001",
  "manifest_digest": "sha256:1111111111111111111111111111111111111111111111111111111111111111",
  "steps": [
    { "step_id": "compile", "output_digest": "sha256:deadbeefdeadbeefdeadbeefdeadbeefdeadbeefdeadbeefdeadbeefdeadbeef" }
  ],
  "trust_labels": [],
  "bundle_sha256": "sha256:6666666666666666666666666666666666666666666666666666666666666666"
}
